{
  "$schema": "https://json-schema.org/draft/2020-12/schema",
  "type": "object",
  "additionalProperties": false,
  "required": [
    "repository",
    "commit",
    "registryPath",
    "components",
    "preservedLocalBehavior"
  ],
  "properties": {
    "$schema": { "type": "string" },
    "repository": { "type": "string", "format": "uri" },
    "commit": { "type": "string", "pattern": "^[a-f0-9]{40}$" },
    "registryPath": { "type": "string", "minLength": 1 },
    "components": {
      "type": "object",
      "additionalProperties": { "type": "string", "minLength": 1 }
    },
    "preservedLocalBehavior": {
      "type": "array",
      "items": { "type": "string", "minLength": 1 },
      "uniqueItems": true
    }
  }
}
